shape_type,profile_family,geometry_parameters,depth_map_generation_rule,projected_mask_generation_rule,topology_label,expected_difficulty,rbc_six_param_representation_valid,new_output_representation_required,recommended_representation_target,primary_failure_mode_to_audit
rbc_like_smooth_pit,smooth radial RBC-style / Piao-inspired pit,"L_m,W_m,D_m,wLD,wWD,wLW,center_xyz_m,rotation_angle",evaluate existing RBC-style six-parameter depth profile on the profile grid,threshold depth_grid_m > 0 and rasterize projected footprint,single_component,control_anchor,True,False,six_param_rbc,do not regress current 20.85 RBC-like profile/depth behavior
flat_bottom_pit,plateau bottom with steep sidewall transition,"L_m,W_m,D_m,wall_slope,corner_radius_m,center_xyz_m,rotation_angle",constant central depth with finite edge ramp controlled by wall_slope/corner_radius_m,threshold nonzero plateau plus edge ramp footprint,single_component,medium_high_edge_sharpness,False,True,polygon_or_contour,smooth RBC output blurs the flat bottom and underestimates edge steepness
sharp_wall_boxy_corrosion,boxy / cuboid-like surface material loss,"L_m,W_m,D_m,corner_radius_m,edge_angle_deg,center_xyz_m,rotation_angle",rectangular or polygonal footprint with near-vertical walls and uniform depth,polygon/rotated-rectangle rasterization of the top-view footprint,single_component,high_corner_boundary_fidelity,False,True,polygon_or_contour,"rounded predicted corners, edge leakage, and wrong straight-boundary length"
asymmetric_corrosion,single pit with skewed depth distribution,"L_m,W_m,D_m,skew_x,skew_y,edge_steepness_left,edge_steepness_right,center_xyz_m",depth surface with one steep side and one shallow side; max depth offset from center,threshold asymmetric depth grid and keep largest connected footprint,single_component,high_profile_asymmetry,False,True,profile_basis,six-parameter output recenters the pit and loses skewed profile shape
elongated_crack_like_surface_defect,long narrow connected slot / crack-like pit,"L_m,W_m,D_m,aspect_ratio,rotation_angle,tip_radius_m,center_xyz_m",rotated high-aspect slot with narrow width and optional tapered tips,rotated elongated footprint rasterization with width-preserving threshold,elongated,high_aspect_rotation_width_recall,False,True,polygon_or_contour,"missed narrow component, aspect collapse, and rotation error"
multi_pit_two_component_surface_defect,two neighboring or separated surface pits,"component_count,component_params_json,component_distance_m,depth_ratio,center_xyz_m",union of two component depth maps with independent size/depth/profile parameters,union of component masks while preserving connected_component_count,multi_component,high_component_recall_merge_split,False,True,component_set,"merged components, missed secondary pit, and wrong component depths"
irregular_non_rbc_corrosion,free-form irregular corrosion with nonuniform depth,"contour_vertices_json,depth_grid_m,local_depth_modes,roughness_score,center_xyz_m",generate a bounded irregular contour and nonuniform depth grid with finite max depth,rasterize contour/depth threshold and store full projected mask,irregular,very_high_free_form_profile,False,True,depth_grid,"over-smoothing, boundary hallucination, and loss of local depth extrema"
