decision_option,selected,condition,observed,next_step
A_imported_watertight_solid_forward_pass,False,"Python watertight mesh, COMSOL import/form solid/Boolean/mesh precheck, and one-sample forward all pass",import/subtract/mesh passed but one-sample imported watertight forward smoke ran but produced no successful inventory rows,design smooth/mesh-based true 3D RBC pilot
B_mesh_pass_comsol_import_or_form_solid_fails,False,Python mesh passes but COMSOL import/form solid/Boolean/mesh precheck does not pass,import/subtract/mesh passed but one-sample imported watertight forward smoke ran but produced no successful inventory rows,fix COMSOL STL import/repair/form-solid workflow
C_import_boolean_pass_forward_fails,True,COMSOL geometry gate passes but Bx/By/Bz forward or schema validation fails,import/subtract/mesh passed but one-sample imported watertight forward smoke ran but produced no successful inventory rows,fix COMSOL solve/export/schema for imported solid
D_python_mesh_generation_fails,False,Watertight mesh generation or validation fails,import/subtract/mesh passed but one-sample imported watertight forward smoke ran but produced no successful inventory rows,fix watertight RBC mesh generator
E_all_fail_or_accept_high_layer,False,Imported route remains blocked and user chooses not to continue builder hardening,not selected by this script,ask whether to accept high-layer approximation or pause smooth builder
