case_id,scope,candidate,seed,profile_depth_rmse_m,reference_profile_depth_rmse_m,relative_change_pct_vs_C0,projected_mask_dice,finding,severity
aggregate_nominal_guard,sensor_z_0.008,A2_latent_residual_adapter_20_94_selected,2026,0.0003358208914505667,0.0003330594072394888,0.8291266215736246,0.8559097468136415,nominal preserved; RMSE degradation stays below 10 percent guard,pass
worst_a2_liftoff_level,sensor_z_0.010,A2_latent_residual_adapter_20_94_selected,2026,0.0004915191093459725,0.0009157611784758046,-46.32671477032273,0.8139296014373907,highest aggregate A2 profile RMSE among liftoff levels; monitor in future per-sample export,watch
best_a2_liftoff_level,sensor_z_0.008,A2_latent_residual_adapter_20_94_selected,2026,0.0003358208914505667,0.0003330594072394888,0.8291266215736246,0.8559097468136415,lowest aggregate A2 profile RMSE among liftoff levels,context
c1_nominal_collapse_reference,sensor_z_0.008,C1_unconditioned_liftoff_aug_20_92_selected,123,0.0008090106257441221,0.0003330594072394888,142.90279996877467,0.8505624809787936,C1 improves some non-nominal rows but damages nominal; not a companion module,fail_reference
c2_posthoc_reference,sensor_z_0.008_and_0.010,C2_sensor_z_full_model_20_92_best_validation,2026,nominal=0.000659520101180533; sensor_z_0.010=0.0005458713003463345,nominal=0.0003330594072394888; sensor_z_0.010=0.0009157611784758046,nominal=98.019; sensor_z_0.010=-40.392,nominal=0.8451823828926919; sensor_z_0.010=0.8173203339189398,C2 is a diagnostic full-model ablation because it was not selected by the 20.92 validation protocol,context
c0_high_liftoff_failure_reference,sensor_z_0.012,C0_frozen_20_85_baseline,42,0.0013493336882675067,,,0.6089468281507759,frozen nominal baseline remains fragile at 0.012 m liftoff,baseline_failure_reference
per_sample_failure_cases_unavailable,test,all,,,,,,No persisted per-sample A2 prediction rows were available; 20.95 does not recompute per-sample failures.,artifact_limitation
